{
  "$schema": "https://json-schema.org/draft/2020-12/schema",
  "title": "Events",
  "type": "array",
  "items": {
    "type": "object",
    "additionalProperties": false,
    "required": ["id", "title", "eventType", "startDate", "endDate", "venueId", "city", "isCommercial"],
    "properties": {
      "id": { "type": "string", "pattern": "^[a-z0-9]+(-[a-z0-9]+)*$" },
      "title": { "type": "string", "minLength": 1 },
      "eventType": { "enum": ["fair_and_convention", "talk", "symposium", "workshop", "vernissage", "reading"] },
      "categoryTags": { "type": "array", "items": { "type": "string", "minLength": 1 } },
      "startDate": { "type": "string", "format": "date" },
      "endDate": { "type": "string", "format": "date" },
      "venueId": { "type": "string", "minLength": 1 },
      "city": { "type": "string", "minLength": 1 },
      "website": { "type": "string", "format": "uri", "pattern": "^https?://" },
      "description": { "type": "string" },
      "isCommercial": { "type": "boolean" },
      "highlights": { "type": "array", "items": { "type": "string", "minLength": 1 } }
    }
  }
}
